{
  "schema": "rover/v1alpha1",
  "objective": "Perform only the approved task; preserve verification requirements.",
  "repository": "/absolute/path/to/owned/repository",
  "base": "HEAD",
  "argv": [
    "/bin/sh"
  ],
  "timeout": "20m",
  "auto_verify": false,
  "max_attempts": 1,
  "agent": "generic-pty",
  "interactive": true
}
